document_number,abstract,action,agencies,agency_names,effective_on,publication_date,significant,subtype,title,topics,type,Search Term
E8-7726,"This document adopts, without change, the interim final rule that was published in the Federal Register on June 22, 2007, addressing data breaches of sensitive personal information that is processed or maintained by the Department of Veterans Affairs (VA). This final rule implements certain provisions of the Veterans Benefits, Health Care, and Information Technology Act of 2006. The regulations prescribe the mechanisms for taking action in response to a data breach of sensitive personal information.",Final rule.,"[{'raw_name': 'DEPARTMENT OF VETERANS AFFAIRS', 'name': 'Veterans Affairs Department', 'id': 520, 'url': 'https://www.federalregister.gov/agencies/veterans-affairs-department', 'json_url': 'https://www.federalregister.gov/api/v1/agencies/520.json', 'parent_id': None, 'slug': 'veterans-affairs-department'}]",['Veterans Affairs Department'],,2008-04-11,True,,Data Breaches,"['Administrative practice and procedure', 'Security measures']",Rule,Data Mining
E7-18877,"In accordance with legislation implementing the results of the Uruguay Round of negotiations under the General Agreement on Tariffs and Trade, we are informing the public of international standard- setting activities of the World Organization for Animal Health, the Secretariat of the International Plant Protection Convention, and the North American Plant Protection Organization, and we are soliciting public comment on the standards to be considered.",Notice and request for comments.,"[{'raw_name': 'DEPARTMENT OF AGRICULTURE', 'name': 'Agriculture Department', 'id': 12, 'url': 'https://www.federalregister.gov/agencies/agriculture-department', 'json_url': 'https://www.federalregister.gov/api/v1/agencies/12.json', 'parent_id': None, 'slug': 'agriculture-department'}, {'raw_name': 'Animal and Plant Health Inspection Service', 'name': 'Animal and Plant Health Inspection Service', 'id': 22, 'url': 'https://www.federalregister.gov/agencies/animal-and-plant-health-inspection-service', 'json_url': 'https://www.federalregister.gov/api/v1/agencies/22.json', 'parent_id': 12, 'slug': 'animal-and-plant-health-inspection-service'}]","['Agriculture Department', 'Animal and Plant Health Inspection Service']",,2007-09-25,,,International Sanitary and Phytosanitary Standard-Setting Activities,[],Notice,Data Mining
E7-17199,"The Assistant Secretary for Special Education and Rehabilitative Services proposes certain funding priorities for the Disability and Rehabilitation Research Projects and Centers Program administered by the National Institute on Disability and Rehabilitation Research (NIDRR). Specifically, this notice proposes 10 priorities for DRRPs, 11 priorities for RRTCs, and 6 priorities for RERCs. The Assistant Secretary may use these priorities for competitions in fiscal year (FY) 2008 and later years. We take this action to focus research attention on areas of national need. We intend these priorities to improve rehabilitation services and outcomes for individuals with disabilities.","Notice of proposed priorities for DRRPs, RRTCs, and RERCs.","[{'raw_name': 'DEPARTMENT OF EDUCATION', 'name': 'Education Department', 'id': 126, 'url': 'https://www.federalregister.gov/agencies/education-department', 'json_url': 'https://www.federalregister.gov/api/v1/agencies/126.json', 'parent_id': None, 'slug': 'education-department'}]",['Education Department'],,2007-08-31,,,"National Institute on Disability and Rehabilitation Research-Disability and Rehabilitation Research Projects and Centers Program-Disability Rehabilitation Research Projects (DRRPs), Rehabilitation Research and Training Centers (RRTCs), and Rehabilitation Engineering Research Centers (RERCs)",[],Notice,Data Mining
E7-13738,"We are adopting rule amendments to extend the current interactive data voluntary reporting program to enable mutual funds voluntarily to submit supplemental tagged information contained in the risk/return summary section of their prospectuses. A mutual fund choosing to tag its risk/return summary information also would continue to file this information in HTML or ASCII format, as currently required. This extension of the voluntary program is intended to help us evaluate the usefulness to investors, third-party analysts, registrants, the Commission, and the marketplace of data tagging and, in particular, of tagging mutual fund information.",Final rule.,"[{'raw_name': 'SECURITIES AND EXCHANGE COMMISSION', 'name': 'Securities and Exchange Commission', 'id': 466, 'url': 'https://www.federalregister.gov/agencies/securities-and-exchange-commission', 'json_url': 'https://www.federalregister.gov/api/v1/agencies/466.json', 'parent_id': None, 'slug': 'securities-and-exchange-commission'}]",['Securities and Exchange Commission'],,2007-07-17,False,,Extension of Interactive Data Voluntary Reporting Program on the Edgar System To Include Mutual Fund Risk/Return Summary Information,"['Investment companies', 'Reporting and recordkeeping requirements', 'Securities']",Rule,Data Mining
07-3085,"This document establishes regulations to address data breaches regarding sensitive personal information that is processed or maintained by the Department of Veterans Affairs (VA). The regulations implement certain provisions of Title IX of the Veterans Benefits, Health Care, and Information Technology Act of 2006, which require promulgation of these regulations as an interim final rule.",Interim final rule.,"[{'raw_name': 'DEPARTMENT OF VETERANS AFFAIRS', 'name': 'Veterans Affairs Department', 'id': 520, 'url': 'https://www.federalregister.gov/agencies/veterans-affairs-department', 'json_url': 'https://www.federalregister.gov/api/v1/agencies/520.json', 'parent_id': None, 'slug': 'veterans-affairs-department'}]",['Veterans Affairs Department'],,2007-06-22,True,,Data Breaches,"['Administrative practice and procedure', 'Security measures']",Rule,Data Mining
07-811,"The Agencies are publishing for comment three documents that set forth proposed supervisory guidance for implementing proposed revisions to the risk-based capital standards in the United States (New Advanced Capital Adequacy Framework or proposed framework). These proposed revisions, which would implement the ``International Convergence of Capital Measurement and Capital Standards: A Revised Framework,'' published in June 2004 by the Basel Committee on Banking Supervision (Basel II), in the United States, were published in the Federal Register on September 25, 2006 as a notice of proposed rulemaking (NPR or proposed rule). The proposed framework outlined in the NPR would require some and permit other qualifying banks to calculate their regulatory risk-based capital requirements using an internal ratings-based (IRB) approach for credit risk and the advanced measurement approaches (AMA) for operational risk (together, the advanced approaches); it also provides guidelines for the supervisory review process (Pillar 2). The proposed supervisory guidance documents provide additional detail for the advanced approaches and the supervisory review process that should help banks satisfy the qualification requirements in the NPR.",Proposed supervisory guidance with request for public comment.,"[{'raw_name': 'DEPARTMENT OF THE TREASURY', 'name': 'Treasury Department', 'id': 497, 'url': 'https://www.federalregister.gov/agencies/treasury-department', 'json_url': 'https://www.federalregister.gov/api/v1/agencies/497.json', 'parent_id': None, 'slug': 'treasury-department'}, {'raw_name': 'Office of the Comptroller of the Currency', 'name': 'Comptroller of the Currency', 'id': 80, 'url': 'https://www.federalregister.gov/agencies/comptroller-of-the-currency', 'json_url': 'https://www.federalregister.gov/api/v1/agencies/80.json', 'parent_id': 497, 'slug': 'comptroller-of-the-currency'}, {'raw_name': 'FEDERAL RESERVE SYSTEM', 'name': 'Federal Reserve System', 'id': 188, 'url': 'https://www.federalregister.gov/agencies/federal-reserve-system', 'json_url': 'https://www.federalregister.gov/api/v1/agencies/188.json', 'parent_id': None, 'slug': 'federal-reserve-system'}, {'raw_name': 'FEDERAL DEPOSIT INSURANCE CORPORATION', 'name': 'Federal Deposit Insurance Corporation', 'id': 164, 'url': 'https://www.federalregister.gov/agencies/federal-deposit-insurance-corporation', 'json_url': 'https://www.federalregister.gov/api/v1/agencies/164.json', 'parent_id': None, 'slug': 'federal-deposit-insurance-corporation'}, {'raw_name': 'DEPARTMENT OF THE TREASURY', 'name': 'Treasury Department', 'id': 497, 'url': 'https://www.federalregister.gov/agencies/treasury-department', 'json_url': 'https://www.federalregister.gov/api/v1/agencies/497.json', 'parent_id': None, 'slug': 'treasury-department'}, {'raw_name': 'Office of Thrift Supervision', 'name': 'Thrift Supervision Office', 'id': 489, 'url': 'https://www.federalregister.gov/agencies/thrift-supervision-office', 'json_url': 'https://www.federalregister.gov/api/v1/agencies/489.json', 'parent_id': 497, 'slug': 'thrift-supervision-office'}]","['Treasury Department', 'Comptroller of the Currency', 'Federal Reserve System', 'Federal Deposit Insurance Corporation', 'Treasury Department', 'Thrift Supervision Office']",,2007-02-28,,,"Proposed Supervisory Guidance for Internal Ratings-Based Systems for Credit Risk, Advanced Measurement Approaches for Operational Risk, and the Supervisory Review Process (Pillar 2) Related to Basel II Implementation",[],Notice,Data Mining
E7-2254,"We are proposing rule amendments to extend the current interactive data voluntary reporting program to enable mutual funds voluntarily to submit supplemental tagged information contained in the risk/return summary section of their prospectuses. A mutual fund choosing to tag its risk/return summary information also would continue to file this information in HTML or ASCII format, as currently required. This extension of the voluntary program is intended to help us evaluate the usefulness to investors, third-party analysts, registrants, the Commission, and the marketplace of data tagging and, in particular, of tagging mutual fund information.",Proposed rule.,"[{'raw_name': 'SECURITIES AND EXCHANGE COMMISSION', 'name': 'Securities and Exchange Commission', 'id': 466, 'url': 'https://www.federalregister.gov/agencies/securities-and-exchange-commission', 'json_url': 'https://www.federalregister.gov/api/v1/agencies/466.json', 'parent_id': None, 'slug': 'securities-and-exchange-commission'}]",['Securities and Exchange Commission'],,2007-02-12,False,,Extension of Interactive Data Voluntary Reporting Program on the EDGAR System To Include Mutual Fund Risk/Return Summary Information,"['Investment companies', 'Reporting and recordkeeping requirements', 'Securities']",Proposed Rule,Data Mining
06-6497,"This document contains final and temporary regulations that provide guidance regarding the treatment of controlled services transactions under section 482 and the allocation of income from intangibles, in particular with respect to contributions by a controlled party to the value of an intangible owned by another controlled party. This document also contains final and temporary regulations that modify the regulations under section 861 concerning stewardship expenses to be consistent with the changes made to the regulations under section 482. These final and temporary regulations potentially affect controlled taxpayers within the meaning of section 482. They provide updated guidance necessary to reflect economic and legal developments since the issuance of the current guidance.",Final and temporary regulations.,"[{'raw_name': 'DEPARTMENT OF THE TREASURY', 'name': 'Treasury Department', 'id': 497, 'url': 'https://www.federalregister.gov/agencies/treasury-department', 'json_url': 'https://www.federalregister.gov/api/v1/agencies/497.json', 'parent_id': None, 'slug': 'treasury-department'}, {'raw_name': 'Internal Revenue Service', 'name': 'Internal Revenue Service', 'id': 254, 'url': 'https://www.federalregister.gov/agencies/internal-revenue-service', 'json_url': 'https://www.federalregister.gov/api/v1/agencies/254.json', 'parent_id': 497, 'slug': 'internal-revenue-service'}]","['Treasury Department', 'Internal Revenue Service']",,2006-08-04,False,,Treatment of Services Under Section 482; Allocation of Income and Deductions From Intangibles; Stewardship Expense,"['Employment taxes', 'Income taxes', 'Penalties', 'Railroad retirement', 'Reporting and recordkeeping requirements']",Rule,Data Mining
05-24223,"The Food and Drug Administration (FDA) proposed, among other things, to classify Anthrax Vaccine Adsorbed (AVA) on the basis of findings and recommendations of the Panel on Review of Bacterial Vaccines and Toxoids (the Panel) on December 13, 1985. The Panel reviewed the safety, efficacy, and labeling of bacterial vaccines and toxoids with standards of potency, bacterial antitoxins, and immune globulins. After the initial final rule and final order was vacated by the United States District Court for the District of Columbia on October 27, 2004, FDA published a new proposed rule and proposed order on December 29, 2004. The purpose of this final order is to categorize AVA according to the evidence of its safety and effectiveness, thereby determining if it may remain licensed and on the market; issue a final response to recommendations made in the Panel's report, and; respond to comments on the previously published proposed order. The final rule and final order concerning bacterial vaccines and toxoids other than AVA is published elsewhere in this issue of the Federal Register.",Notice.,"[{'raw_name': 'DEPARTMENT OF HEALTH AND HUMAN SERVICES', 'name': 'Health and Human Services Department', 'id': 221, 'url': 'https://www.federalregister.gov/agencies/health-and-human-services-department', 'json_url': 'https://www.federalregister.gov/api/v1/agencies/221.json', 'parent_id': None, 'slug': 'health-and-human-services-department'}, {'raw_name': 'Food and Drug Administration', 'name': 'Food and Drug Administration', 'id': 199, 'url': 'https://www.federalregister.gov/agencies/food-and-drug-administration', 'json_url': 'https://www.federalregister.gov/api/v1/agencies/199.json', 'parent_id': 221, 'slug': 'food-and-drug-administration'}]","['Health and Human Services Department', 'Food and Drug Administration']",2005-12-19,2005-12-19,,,Biological Products; Bacterial Vaccines and Toxoids; Implementation of Efficacy Review; Anthrax Vaccine Adsorbed; Final Order,[],Notice,Data Mining
05-19910,"This interim final rule sets forth the State requirements to provide information to us for purposes of estimating improper payments in Medicaid and the State Children's Health Insurance Program (SCHIP), as required under the Improper Payments Information Act (IPIA) of 2002. The IPIA requires heads of Federal agencies to annually estimate and report to the Congress these estimates of improper payments for the programs they oversee and, submit a report on actions the agency is taking to reduce erroneous payments. We published a proposed rule on August 27, 2004 to propose that States measure improper payments in Medicaid and SCHIP and report the State-specific error rates to us for purposes of computing the improper payment estimates for these programs. After extensive analysis of the issues related to having States measure improper payments in Medicaid and SCHIP, including public comments on the provisions in the proposed rule, we are revising our proposed approach. Our new approach incorporates commenters' suggestions to engage a Federal contractor by contracting with that entity to complete the data processing and medical reviews and calculate the State-specific error rates. Based on the States' error rates, the contractor also will calculate the improper payment estimates for these programs which will be reported by the Department of Health and Human Services as required by the IPIA. This interim final rule sets out the types of information that States would need to submit to allow CMS to conduct medical and data processing reviews on claims made in the fee-for-service (FFS) setting. CMS will address estimating improper payments for Medicaid managed care and eligibility and SCHIP FFS, managed care and eligibility at a later time. This rule responds to the public comments on the proposed rule, sets forth the requirements for States to assist us and the contractor to produce State-specific error rates in Medicaid and SCHIP which will be used as the basis for a national error rate, and outlines future plans for measuring eligibility, which may include greater State involvement than the level required for the medical and data processing reviews.",Interim final rule with comment period.,"[{'raw_name': 'DEPARTMENT OF HEALTH AND HUMAN SERVICES', 'name': 'Health and Human Services Department', 'id': 221, 'url': 'https://www.federalregister.gov/agencies/health-and-human-services-department', 'json_url': 'https://www.federalregister.gov/api/v1/agencies/221.json', 'parent_id': None, 'slug': 'health-and-human-services-department'}, {'raw_name': 'Centers for Medicare & Medicaid Services', 'name': 'Centers for Medicare & Medicaid Services', 'id': 45, 'url': 'https://www.federalregister.gov/agencies/centers-for-medicare-medicaid-services', 'json_url': 'https://www.federalregister.gov/api/v1/agencies/45.json', 'parent_id': 221, 'slug': 'centers-for-medicare-medicaid-services'}]","['Health and Human Services Department', 'Centers for Medicare & Medicaid Services']",,2005-10-05,False,,Medicaid Program and State Children's Health Insurance Program (SCHIP) Payment Error Rate Measurement,"['Administrative practice and procedure', 'Grant programs-health', 'Health facilities', 'Health insurance', 'Medicaid', 'Privacy', 'Reporting and recordkeeping requirements']",Rule,Data Mining
05-14037,The Federal Crop Insurance Corporation (FCIC) amends the General Administrative Regulations to include provisions regarding the requests by approved insurance providers to implement the premium reduction plan authorized under section 508(e)(3) of the Federal Crop Insurance Act (Act) and the approval of the amount of a premium discount to be provided to farmers under the premium reduction plan.,Interim rule.,"[{'raw_name': 'DEPARTMENT OF AGRICULTURE', 'name': 'Agriculture Department', 'id': 12, 'url': 'https://www.federalregister.gov/agencies/agriculture-department', 'json_url': 'https://www.federalregister.gov/api/v1/agencies/12.json', 'parent_id': None, 'slug': 'agriculture-department'}, {'raw_name': 'Federal Crop Insurance Corporation', 'name': 'Federal Crop Insurance Corporation', 'id': 163, 'url': 'https://www.federalregister.gov/agencies/federal-crop-insurance-corporation', 'json_url': 'https://www.federalregister.gov/api/v1/agencies/163.json', 'parent_id': 12, 'slug': 'federal-crop-insurance-corporation'}]","['Agriculture Department', 'Federal Crop Insurance Corporation']",2005-06-30,2005-07-20,False,,"General Administrative Regulations, Subpart V-Submission of Policies, Provisions of Policies, Rates of Premium, and Premium Reduction Plans","['Administrative practice and procedure', 'Crop insurance', 'Disaster assistance', 'Fraud', 'Penalties', 'Reporting and recordkeeping requirements']",Rule,Data Mining
05-10663,"This notice announces the date, time, location, and agenda for the next meeting of the Department of Homeland Security Data Privacy and Integrity Advisory Committee.",Notice of Federal Advisory Committee Meeting.,"[{'raw_name': 'DEPARTMENT OF HOMELAND SECURITY', 'name': 'Homeland Security Department', 'id': 227, 'url': 'https://www.federalregister.gov/agencies/homeland-security-department', 'json_url': 'https://www.federalregister.gov/api/v1/agencies/227.json', 'parent_id': None, 'slug': 'homeland-security-department'}, {'raw_name': 'Office of the Secretary'}]","['Homeland Security Department', 'Office of the Secretary']",,2005-05-31,,,Data Privacy and Integrity Advisory Committee,[],Notice,Data Mining
05-8099,,,"[{'raw_name': 'DEPARTMENT OF EDUCATION', 'name': 'Education Department', 'id': 126, 'url': 'https://www.federalregister.gov/agencies/education-department', 'json_url': 'https://www.federalregister.gov/api/v1/agencies/126.json', 'parent_id': None, 'slug': 'education-department'}]",['Education Department'],,2005-04-22,,,Office of Special Education and Rehabilitative Services; Overview Information; Technology and Media Services for Individuals With Disabilities-Technology and Standards-Based Reform; Notice Inviting Applications for New Awards for Fiscal Year (FY) 2005,[],Notice,Data Mining
04-18056,"The Federal Crop Insurance Corporation (FCIC) finalizes the Group Risk Plan of Insurance Regulations (GRP Provisions); and the Common Crop Insurance Regulations, Basic Provisions (Basic Provisions) to make revisions that will reduce program vulnerabilities and clarify existing policy provisions to better meet the needs of the insured. Further, FCIC is making conforming amendments to the General Administrative Regulations, Subpart L--Reinsurance Agreement--Standards for Approval; Regulations for the 1997 and Subsequent Reinsurance Years and Subpart P--Preemption of State Laws and Regulations, and the Catastrophic Risk Protection Endorsement. The changes will apply for the 2005 and succeeding crop years for all crops with a contract change date on or after the effective date of this rule, and for the 2006 and succeeding crop years for all crops with a contract change date prior to the effective date of this rule. In addition, FCIC is finalizing the interim rule published on June 30, 2000, implementing statutory mandates of the Agricultural Risk Protection Act of 2000 (ARPA).",Final rule.,"[{'raw_name': 'DEPARTMENT OF AGRICULTURE', 'name': 'Agriculture Department', 'id': 12, 'url': 'https://www.federalregister.gov/agencies/agriculture-department', 'json_url': 'https://www.federalregister.gov/api/v1/agencies/12.json', 'parent_id': None, 'slug': 'agriculture-department'}, {'raw_name': 'Federal Crop Insurance Corporation', 'name': 'Federal Crop Insurance Corporation', 'id': 163, 'url': 'https://www.federalregister.gov/agencies/federal-crop-insurance-corporation', 'json_url': 'https://www.federalregister.gov/api/v1/agencies/163.json', 'parent_id': 12, 'slug': 'federal-crop-insurance-corporation'}]","['Agriculture Department', 'Federal Crop Insurance Corporation']",2004-08-30,2004-08-10,True,,"General Administrative Regulations, Catastrophic Risk Protection Endorsement; Group Risk Plan of Insurance Regulations for the 2004 and Succeeding Crop Years; and the Common Crop Insurance Regulations, Basic Provisions","['Administrative practice and procedure', 'Claims', 'Crop insurance', 'Fraud', 'Reporting and recordkeeping requirements']",Rule,Data Mining
04-16126,The inventions listed below are owned by an agency of the U.S. Government and are available for licensing in the U.S. in accordance with 35 U.S.C. 207 to achieve expeditious commercialization of results of federally-funded research and development. Foreign patent applications are filed on selected inventions to extend market coverage for companies and may also be available for licensing.,Notice.,"[{'raw_name': 'DEPARTMENT OF HEALTH AND HUMAN SERVICES', 'name': 'Health and Human Services Department', 'id': 221, 'url': 'https://www.federalregister.gov/agencies/health-and-human-services-department', 'json_url': 'https://www.federalregister.gov/api/v1/agencies/221.json', 'parent_id': None, 'slug': 'health-and-human-services-department'}, {'raw_name': 'National Institutes of Health', 'name': 'National Institutes of Health', 'id': 353, 'url': 'https://www.federalregister.gov/agencies/national-institutes-of-health', 'json_url': 'https://www.federalregister.gov/api/v1/agencies/353.json', 'parent_id': 221, 'slug': 'national-institutes-of-health'}]","['Health and Human Services Department', 'National Institutes of Health']",,2004-07-16,,,Government-Owned Inventions; Availability for Licensing,[],Notice,Data Mining
04-10220,"The Small Business Paperwork Relief Task Force requests comments on the attached Draft Report. In this Draft Report, the Small Business Paperwork Relief Task Force discusses and makes recommendations concerning the improvement of electronic dissemination of information collected under Federal requirements and a plan to develop an interactive Government-wide Internet program to identify applicable collections and facilitate compliance.",Notice and request for comments.,"[{'raw_name': 'OFFICE OF MANAGEMENT AND BUDGET', 'name': 'Management and Budget Office', 'id': 280, 'url': 'https://www.federalregister.gov/agencies/management-and-budget-office', 'json_url': 'https://www.federalregister.gov/api/v1/agencies/280.json', 'parent_id': None, 'slug': 'management-and-budget-office'}]",['Management and Budget Office'],,2004-05-05,,,Executive Office of the President; Draft Report of the Small Business Paperwork Relief Act Task Force,[],Notice,Data Mining
